<?xml version="1.0" encoding="ISO-8859-1"?>
<!--
    This is the default streaming data producer configuration file.
    The values here can be overwritten by a customized configuration file passed to the producer executable or library.

    Created by bbehzadi on 2/10/14.
-->
<StreamingDataProducer xmlns="http://www.eksiir.com/producer"
                       xmlns:xsi="http://www.w3.org/2001/XMLSchema-instance"
                       xsi:schemaLocation="http://www.eksiir.com/producer ProducerConfigSchema.xsd">
    <StreamingData context="producer">
        <Source>LOG_FILE</Source>
        <Carrier>KINESIS</Carrier>
    </StreamingData>
    <LogTailer>
        <Filename>/tmp/log.out</Filename>
        <MillisecDelay>0</MillisecDelay>
    </LogTailer>
    <Kinesis>
        <Region>us-east-1</Region>
        <EndPoint>https://kinesis.us-east-1.amazonaws.com</EndPoint>
        <CredentialsPropertiesFileName>AwsCredentials.properties</CredentialsPropertiesFileName>
        <StreamName>Orders</StreamName>
    </Kinesis>
</StreamingDataProducer>
